[
  {
    "capability_tier": "metadata_only",
    "codes": {
      "barcode_expectation": "unknown",
      "cryptographic_specification": null,
      "issuer_prefixes": [
        "CBSE"
      ],
      "payload_format": "issuer_specific",
      "qr_expectation": "optional",
      "required_keys": []
    },
    "completeness": 72,
    "digital_signature": {
      "allowed_formats": [
        "adbe.pkcs7.detached",
        "ETSI.CAdES.detached"
      ],
      "expectation": "optional",
      "trusted_issuer_ids": []
    },
    "document_family": "academic.cbse_class_10_documents",
    "enabled": true,
    "expected_pages": {
      "dimensions": [],
      "maximum": 10,
      "minimum": 1,
      "orientation": "portrait"
    },
    "fields": [
      {
        "field_id": "name",
        "format": "^[A-Za-z][A-Za-z .'-]{1,119}$",
        "labels": [
          "name",
          "student name",
          "candidate name"
        ],
        "page": 1,
        "required": false,
        "sensitive": true
      },
      {
        "field_id": "document_number",
        "format": "^[A-Za-z0-9][A-Za-z0-9/ ._-]{2,63}$",
        "labels": [
          "document number",
          "registration number",
          "registration no",
          "roll number",
          "receipt number",
          "licence number",
          "passport number",
          "visa number",
          "elector number"
        ],
        "page": 1,
        "required": false,
        "sensitive": true
      },
      {
        "field_id": "issue_date",
        "format": "^(?:[0-3]?\\d[-/.][01]?\\d[-/.](?:19|20)\\d{2}|(?:19|20)\\d{2}[-/.][01]?\\d[-/.][0-3]?\\d)$",
        "labels": [
          "issue date",
          "date of issue",
          "issued on"
        ],
        "page": 1,
        "required": false,
        "sensitive": true
      },
      {
        "field_id": "total",
        "format": "^\\d+(?:\\.\\d+)?$",
        "labels": [
          "total",
          "total marks",
          "total earned points"
        ],
        "page": 1,
        "required": false,
        "sensitive": false
      },
      {
        "field_id": "maximum",
        "format": "^\\d+(?:\\.\\d+)?$",
        "labels": [
          "maximum marks",
          "max marks"
        ],
        "page": 1,
        "required": false,
        "sensitive": false
      },
      {
        "field_id": "percentage",
        "format": "^\\d+(?:\\.\\d+)?%?$",
        "labels": [
          "percentage"
        ],
        "page": 1,
        "required": false,
        "sensitive": false
      },
      {
        "field_id": "cgpa",
        "format": "^\\d+(?:\\.\\d+)?$",
        "labels": [
          "cgpa",
          "sgpa"
        ],
        "page": 1,
        "required": false,
        "sensitive": false
      },
      {
        "field_id": "result",
        "format": "^(?:pass|fail|qualified|withheld)$",
        "labels": [
          "result",
          "status"
        ],
        "page": 1,
        "required": false,
        "sensitive": false
      }
    ],
    "issuer": {
      "aliases": [
        "CBSE"
      ],
      "id": "in.cbse",
      "name": "Central Board of Secondary Education"
    },
    "jurisdiction": {
      "country": "IN",
      "state": null
    },
    "keywords": [
      "cbse",
      "class 10",
      "secondary school",
      "marksheet"
    ],
    "known_limitations": [
      "No official document bytes or universal visual template are bundled.",
      "Regional, year, language and delivery-channel variants may differ.",
      "A profile match cannot verify personal field values or issuance."
    ],
    "languages": [
      "en"
    ],
    "layout_anchors": [
      {
        "anchor_id": "heading-1",
        "box": {
          "height": 0.07,
          "width": 0.84,
          "x": 0.08,
          "y": 0.05
        },
        "page": 1,
        "text": "Central Board of Secondary Education",
        "tolerance": 0.16
      },
      {
        "anchor_id": "heading-2",
        "box": {
          "height": 0.07,
          "width": 0.84,
          "x": 0.08,
          "y": 0.13
        },
        "page": 1,
        "text": "Secondary School Examination",
        "tolerance": 0.16
      }
    ],
    "logical_rules": [
      {
        "explanation": "Expected stable issuer or document-family text should be present.",
        "fields": [],
        "minimum_ocr_confidence": 45,
        "parameters": {
          "texts": [
            "Central Board of Secondary Education",
            "Secondary School Examination"
          ]
        },
        "rule_id": "fixed-heading-present",
        "type": "fixed_text_present",
        "version": "1.0.0"
      },
      {
        "explanation": "The visible document number should match the profile format.",
        "fields": [
          "document_number"
        ],
        "minimum_ocr_confidence": 55,
        "parameters": {
          "pattern": "^[A-Za-z0-9][A-Za-z0-9/ ._-]{2,63}$"
        },
        "rule_id": "document-number-format",
        "type": "regex",
        "version": "1.0.0"
      },
      {
        "explanation": "An expiry date, when present, must follow the issue date.",
        "fields": [
          "issue_date",
          "expiry_date"
        ],
        "minimum_ocr_confidence": 60,
        "parameters": {
          "allow_equal": false
        },
        "rule_id": "issue-before-expiry",
        "type": "date_order",
        "version": "1.0.0"
      },
      {
        "explanation": "Displayed percentage should agree with total and maximum marks.",
        "fields": [
          "total",
          "maximum",
          "percentage"
        ],
        "minimum_ocr_confidence": 65,
        "parameters": {
          "tolerance": 0.2
        },
        "rule_id": "percentage-from-total",
        "type": "percentage_matches",
        "version": "1.0.0"
      },
      {
        "explanation": "CGPA or SGPA should lie within the configured ten-point range.",
        "fields": [
          "cgpa"
        ],
        "minimum_ocr_confidence": 60,
        "parameters": {
          "maximum": 10,
          "minimum": 0
        },
        "rule_id": "cgpa-range",
        "type": "numeric_range",
        "version": "1.0.0"
      }
    ],
    "profile_confidence": 82,
    "profile_id": "in.cbse.class10.generic.v1",
    "provenance": {
      "assurance": "P2",
      "description": "Derived conservatively from official-source metadata in the detached DocuVault R1 export; no official document bytes are bundled.",
      "kind": "authoritative_metadata"
    },
    "reference_assets": [],
    "regions": {
      "fixed": [
        {
          "box": {
            "height": 0.2,
            "width": 0.92,
            "x": 0.04,
            "y": 0.03
          },
          "label": "Issuer and document heading",
          "page": 1,
          "region_id": "fixed-header"
        }
      ],
      "unknown": [],
      "variable": [
        {
          "box": {
            "height": 0.64,
            "width": 0.9,
            "x": 0.05,
            "y": 0.2
          },
          "label": "Document-specific values",
          "page": 1,
          "region_id": "variable-content"
        }
      ]
    },
    "schema_version": "1.0.0",
    "scripts": [
      "Latn"
    ],
    "security_regions": {
      "barcode": [],
      "handwriting": [],
      "logo": [
        {
          "box": {
            "height": 0.16,
            "width": 0.22,
            "x": 0.04,
            "y": 0.04
          },
          "label": "Issuer logo area",
          "page": 1,
          "region_id": "logo"
        }
      ],
      "photo": [],
      "qr": [
        {
          "box": {
            "height": 0.22,
            "width": 0.2,
            "x": 0.72,
            "y": 0.68
          },
          "label": "QR area",
          "page": 1,
          "region_id": "qr"
        }
      ],
      "seal": [],
      "signature": [
        {
          "box": {
            "height": 0.12,
            "width": 0.36,
            "x": 0.55,
            "y": 0.78
          },
          "label": "Signature area",
          "page": 1,
          "region_id": "signature"
        }
      ]
    },
    "source": {
      "authoritative_url": "https://cbse.digitallocker.gov.in/",
      "format": "metadata",
      "licence": null,
      "record_id": "academic.cbse.repository.class10.class12",
      "redistribution_status": "unclear",
      "retrieved_at": "2026-08-28",
      "sha256": null
    },
    "stable_headings": [
      "Central Board of Secondary Education",
      "Secondary School Examination",
      "Statement of Marks"
    ],
    "stable_labels": [
      "roll number",
      "name",
      "school",
      "marks"
    ],
    "subtype": "class_10_marksheet",
    "supported_formats": [
      "pdf",
      "png",
      "jpeg"
    ],
    "typography": {
      "alignment": "mixed",
      "appearance_descriptors": [
        "Stable headings should retain consistent stroke weight and spacing.",
        "Variable values may change but their local typography and background integrity remain testable."
      ],
      "case": "mixed",
      "weight": "mixed"
    },
    "validity": {
      "from_year": null,
      "notes": "Issuer, state, year and delivery-channel variants require runtime applicability review.",
      "to_year": null
    },
    "version": "generic-v1"
  },
  {
    "capability_tier": "metadata_only",
    "codes": {
      "barcode_expectation": "unknown",
      "cryptographic_specification": null,
      "issuer_prefixes": [
        "CBSE"
      ],
      "payload_format": "issuer_specific",
      "qr_expectation": "optional",
      "required_keys": []
    },
    "completeness": 72,
    "digital_signature": {
      "allowed_formats": [
        "adbe.pkcs7.detached",
        "ETSI.CAdES.detached"
      ],
      "expectation": "optional",
      "trusted_issuer_ids": []
    },
    "document_family": "academic.cbse_class_12_documents",
    "enabled": true,
    "expected_pages": {